"DESCRIPTION","DURATION IN MS","NAME","PARENT SUITE","START TIME","STATUS","STOP TIME","SUB SUITE","SUITE","TEST CLASS","TEST METHOD"
"","20962","Verify elements visibility on the login page","","Fri Aug 30 13:14:31 UTC 2024","passed","Fri Aug 30 13:14:52 UTC 2024","","Login functionality","",""
"","18280","Should successfully Login with valid credentials","","Fri Aug 30 13:14:34 UTC 2024","passed","Fri Aug 30 13:14:52 UTC 2024","","Login functionality","",""
"","3805","Should swipe down and see 'You found me'","","Fri Aug 30 13:14:52 UTC 2024","passed","Fri Aug 30 13:14:56 UTC 2024","","Swipe functionality","",""
"","6807","Should get error when Login with invalid credentials","","Fri Aug 30 13:14:45 UTC 2024","passed","Fri Aug 30 13:14:52 UTC 2024","","Login functionality","",""
"","55864","Should drag and drop image""","","Fri Aug 30 13:14:35 UTC 2024","passed","Fri Aug 30 13:15:31 UTC 2024","","Drag and drop testing","",""
